{
  "config_path": "configs/base.yaml",
  "config_sha256": "30508e93eab0d421f36d235a230949bf28a5f44d3bdae5c80bea017830df7f77",
  "created_at_utc": "2026-09-28T16:40:08.109698Z",
  "dependency_snapshot_path": "reports/t001/dependencies.txt",
  "dependency_snapshot_sha256": "e68c3d3eab6fa881350ee929491df808c16b1488d1af8f2b0d2c7961149ede9e",
  "git_commit": "645de3328d990c38ca60055c6a79d8833bfe95c7",
  "git_dirty": true,
  "input_artifacts": [
    {
      "path": "simulation/__init__.py",
      "sha256": "ec9fe1c4fb7a55726b1d2c9bb7fa4a8e9cfb6b75ee674f9008ba56e31453f3c7"
    },
    {
      "path": "simulation/types.py",
      "sha256": "6fea1df3b01ab3a8b39e7af1b6c972bcb1218e19019823cab84fa9b88dad8b43"
    },
    {
      "path": "simulation/profiles.py",
      "sha256": "f1b9d483d3334dac9db401338e396bf18a5a87955401d585f3bcdaa2811ece0f"
    },
    {
      "path": "simulation/wearable.py",
      "sha256": "87d9ac41464e0e154765e610042139695e6da6cfdb4eb73f8813edecd75aaf6e"
    },
    {
      "path": "simulation/fixtures.py",
      "sha256": "aa78976afb7711ef57fa2e5bd0c3cedc1b355b1edfd70f28b79b5285ea720745"
    },
    {
      "path": "deployment/mock_inference.py",
      "sha256": "aea6effbc982421d70ffc07e37139af0c432f7913a3d0c900c2a951fd275546a"
    },
    {
      "path": "fusion/state_machine.py",
      "sha256": "7b3a70e322901c5deeaad6f9519c89a5bb9f1d7de18f7e9d6a5e29581517bb17"
    },
    {
      "path": "api/app.py",
      "sha256": "66af547efa8efaa390aeda6ad82ff03bfaa2a9b92db21a1e9486383869323a9b"
    },
    {
      "path": "tests/fixtures/session_v1.jsonl",
      "sha256": "72b393781170dbc45baea3c2df81baff9019c7a5596a6bb5f367e7d955dd410f"
    },
    {
      "path": "tests/fixtures/session_v1_truth.jsonl",
      "sha256": "fbd73018986c91deec5b610e98139ee4d811bb6f4a33048569035ef53578cb8d"
    },
    {
      "path": "tests/fixtures/session_v1_manifest.json",
      "sha256": "ba6249f388e1d07765ffd7670e5115e7a75d62f805202cd1153bc621282b3836"
    },
    {
      "path": "configs/simulation/WEARABLE_SIM_V1.yaml",
      "sha256": "236b3d0a8faeb8f45dfa4c61eb07630927f5e9ca5afa497e3ce94f8f866f849e"
    }
  ],
  "manifest_version": "1.0",
  "notes": "Fixture vertical slice 0: WEARABLE_SIM_SMOKE -> MOCK_INFERENCE_V0 -> FIXTURE_STATE_POLICY_V0 -> FixtureApiResponseV0. Software evidence only; T004 remains BLOCKED_HARDWARE and G1/G16 are not marked PASS.",
  "output_artifacts": [
    {
      "path": "reports/t005/smoke_report.json",
      "sha256": "cee97d1003d7c86fd53c61cbad60318cfddd960327b5a4fedd1ca2739b90b65f"
    },
    {
      "path": "reports/t005/simulation_fixture_manifest.json",
      "sha256": "26d95486506d3f4cc72990786e10310f7ef98389320d9b961399d1ee3e0812f0"
    }
  ],
  "phase_id": "T005",
  "platform": "macOS-27.0-arm64-arm-64bit",
  "python_version": "3.11.16",
  "run_id": "T005-VERTICAL-SLICE-V1",
  "seed": null,
  "spec_version": "2.2",
  "task_id": "T005"
}
