{
  "config_path": "configs/baseline_v1.yaml",
  "config_sha256": "176c07f810125ffecf13d1d3cc0cadd98b17f4d9cfda7bc248260d34888503cf",
  "created_at_utc": "2026-09-29T10:44:06.937343Z",
  "dependency_snapshot_path": "requirements-dev.lock",
  "dependency_snapshot_sha256": "f6bec5065deff4b1c53892e3fa014904ef20bcb4e7005acf764077c50a04f893",
  "git_commit": "4027c39ad3f023514ebb2fb468a790abc5d9831f",
  "git_dirty": true,
  "input_artifacts": [
    {
      "path": "manifests/labels/AAMI_SVF_MAP_V1.yaml",
      "sha256": "6a4aaf0fb5534ae8c6ecfc523bbe939f54ba3b85ca86c73159279a018a055145"
    },
    {
      "path": "manifests/splits/MITDB_SPLIT_V1.lock.json",
      "sha256": "b7aa53ba92627f17961c6befa891108ee5aaa6105853ef043db727f98b969b22"
    },
    {
      "path": "manifests/preprocessing/PREPROC_V1.lock.json",
      "sha256": "181c567e691bef7ee166b09840a22d21763a809ee04b5e8e3cca41ffb56b4b3c"
    },
    {
      "path": "manifests/windows/MITDB_WINDOWS_V1.csv",
      "sha256": "1a68da870c129d77c438a2254fdbfa4eac71181a1a10cf30076ec9e9109d0f4a"
    },
    {
      "path": "manifests/windows/MITDB_WINDOWS_V1.cache.csv",
      "sha256": "35610daa9e0611cca9976664af0e37492011637e085ba866806f378092c6fe4d"
    }
  ],
  "manifest_version": "1.0",
  "notes": "TRAIN-only majority, imputation, scaling, logistic regression, and random forest; VALIDATION descriptive reporting only. CALIBRATION, INTERNAL_TEST, INCART, NSTDB, BIDMC, and wearable caches were not accessed. No search, calibration, or CI.",
  "output_artifacts": [
    {
      "path": "manifests/features/BASELINE_FEATURES_V1.schema.json",
      "sha256": "032bc98b0a6153e373691c3012ce0ca4024a8e9a0071cc7da616d20b663acb55"
    },
    {
      "path": "manifests/features/MITDB_BASELINE_FEATURES_V1.csv",
      "sha256": "6b1ab4f282ebe1bb0793ad087cce956d1018adcf436aa88e5b3d3437725d33c5"
    },
    {
      "path": "artifacts/baselines/BASELINE_V1/feature_transform.joblib",
      "sha256": "5c959f007ad0d773dca487b4ead79a7c0127f70374a9e9b14952097828071341"
    },
    {
      "path": "artifacts/baselines/BASELINE_V1/majority.json",
      "sha256": "f152d856d41bcd6a8454367b7c35e133c50d8cd5dbaaeaca05ec414d8f7b3d88"
    },
    {
      "path": "artifacts/baselines/BASELINE_V1/logistic.joblib",
      "sha256": "08519b50f624b8afd5dffebe154a97013323715cd3fe04f2c9c49bcb2be4a0ee"
    },
    {
      "path": "artifacts/baselines/BASELINE_V1/random_forest.joblib",
      "sha256": "2534f43bd6aca3c828ba381553c7fd345795d749d97faa5e818a3371e1e2c35d"
    },
    {
      "path": "reports/baselines/baseline_report.json",
      "sha256": "f9b33023e8f9f3f5fc1b3678b4e8158a424d0a3ddfa7f660dfa5d352a1722e72"
    },
    {
      "path": "reports/baselines/baseline_metrics.csv",
      "sha256": "a32cd61480aade3b162e9dfc49f980c293835edd6910192b4f5eff75120e8520"
    },
    {
      "path": "reports/t014/feature_audit.json",
      "sha256": "3e81668b73daf4c924c66505999f42470e7c0f6ad09f008c18b186fe7d0dd44c"
    },
    {
      "path": "reports/t014/fit_scope_audit.json",
      "sha256": "3795e509a4bd6d811cbadbb3673b59489a3f42e31d0d9eb6bc5a49560453952c"
    },
    {
      "path": "reports/t014/reproducibility.json",
      "sha256": "d7c2e9987e036add047b2467583f4bc65dbb3eeac4c8934a51b02771838ac0a4"
    },
    {
      "path": "reports/t014/baseline_freeze_audit.json",
      "sha256": "c2ff94f13ca44cb8debf8e032446072ec00bb399d8124894790fb1f6ad4402d2"
    },
    {
      "path": "manifests/baselines/BASELINE_V1.lock.json",
      "sha256": "38f94cb210fe8872f5a195dee606740bf0d6ae3a93be576c88eb60a88f2021c5"
    }
  ],
  "phase_id": "T014",
  "platform": "macOS-27.0-arm64-arm-64bit",
  "python_version": "3.11.16",
  "run_id": "T014-BASELINE-V1",
  "seed": 20260927,
  "spec_version": "2.2",
  "task_id": "T014"
}
